name,rarity,color_identity,owned_qty,text,mana_cost
Irascible Wolverine,common,['R'],1,"When this creature enters, exile the top card of your library. Until end of turn, you may play that card.
Plot {2}{R} (You may pay {2}{R} and exile this card from your hand. Cast it as a sorcery on a later turn without paying its mana cost. Plot only as a sorcery.)",{2}{R}
Iron-Fist Pulverizer,common,['R'],1,"Reach
Whenever you cast your second spell each turn, this creature deals 2 damage to target opponent. Scry 1. (Look at the top card of your library. You may put that card on the bottom.)",{4}{R}
"Magda, the Hoardmaster",rare,['R'],1,"Whenever you commit a crime, create a tapped Treasure token. This ability triggers only once each turn. (Targeting opponents, anything they control, and/or cards in their graveyards is a crime.)
Sacrifice three Treasures: Create a 4/4 red Scorpion Dragon creature token with flying and haste. Activate only as a sorcery.",{1}{R}
Mine Raider,common,['R'],2,"Trample
When this creature enters, if you control another outlaw, create a Treasure token. (Assassins, Mercenaries, Pirates, Rogues, and Warlocks are outlaws. A Treasure token is an artifact with ""{T}, Sacrifice this token: Add one mana of any color."")",{2}{R}
Outlaws' Fury,common,['R'],3,"Creatures you control get +2/+0 until end of turn. If you control an outlaw, exile the top card of your library. Until the end of your next turn, you may play that card. (Assassins, Mercenaries, Pirates, Rogues, and Warlocks are outlaws.)",{2}{R}
Quick Draw,common,['R'],1,Target creature you control gets +1/+1 and gains first strike until end of turn. Creatures target opponent controls lose first strike and double strike until end of turn.,{R}
Quilled Charger,common,['R'],1,"Whenever this creature attacks while saddled, it gets +1/+2 and gains menace until end of turn. (It can't be blocked except by two or more creatures.)
Saddle 2 (Tap any number of other creatures you control with total power 2 or more: This Mount becomes saddled until end of turn. Saddle only as a sorcery.)",{3}{R}
Reckless Lackey,common,['R'],3,"First strike, haste
{2}{R}, Sacrifice this creature: Draw a card and create a Treasure token. (It's an artifact with ""{T}, Sacrifice this token: Add one mana of any color."")",{R}
Rodeo Pyromancers,common,['R'],3,"Whenever you cast your first spell each turn, add {R}{R}.",{3}{R}
Scorching Shot,uncommon,['R'],2,Scorching Shot deals 5 damage to target creature.,{R}{R}
Take for a Ride,uncommon,['R'],1,"Take for a Ride has flash as long as you've committed a crime this turn. (Targeting opponents, anything they control, and/or cards in their graveyards is a crime.)
Gain control of target creature until end of turn. Untap that creature. It gains haste until end of turn.",{2}{R}
Terror of the Peaks,rare,['R'],1,"Flying
Spells your opponents cast that target this creature cost an additional 3 life to cast.
Whenever another creature you control enters, this creature deals damage equal to that creature's power to any target.",{3}{R}{R}
Thunder Salvo,common,['R'],3,"Thunder Salvo deals X damage to target creature, where X is 2 plus the number of other spells you've cast this turn.",{1}{R}
Trick Shot,common,['R'],2,Trick Shot deals 6 damage to target creature and 2 damage to up to one other target creature token.,{4}{R}
"Breeches, the Blastmaker",rare,"['R', 'U']",2,"Menace
Whenever you cast your second spell each turn, you may sacrifice an artifact. If you do, flip a coin. When you win the flip, copy that spell. You may choose new targets for the copy. When you lose the flip, Breeches deals damage equal to that spell's mana value to any target.",{1}{U}{R}
"Kraum, Violent Cacophony",uncommon,"['R', 'U']",1,"Flying
Whenever you cast your second spell each turn, put a +1/+1 counter on Kraum and draw a card.",{2}{U}{R}
Laughing Jasper Flint,rare,"['B', 'R']",1,"Creatures you control but don't own are Mercenaries in addition to their other types.
At the beginning of your upkeep, exile the top X cards of target opponent's library, where X is the number of outlaws you control. Until end of turn, you may cast spells from among those cards, and mana of any type can be spent to cast those spells.",{1}{B}{R}
"Malcolm, the Eyes",rare,"['R', 'U']",1,"Flying, haste
Whenever you cast your second spell each turn, investigate. (Create a Clue token. It's an artifact with ""{2}, Sacrifice this token: Draw a card."")",{U}{R}
Rakdos Joins Up,rare,"['B', 'R']",1,"When Rakdos Joins Up enters, return target creature card from your graveyard to the battlefield with two additional +1/+1 counters on it.
Whenever a legendary creature you control dies, Rakdos Joins Up deals damage equal to that creature's power to target opponent.",{3}{B}{R}
Slick Sequence,uncommon,"['R', 'U']",2,"Slick Sequence deals 2 damage to any target. If you've cast another spell this turn, draw a card.",{U}{R}
"Vial Smasher, Gleeful Grenadier",uncommon,"['B', 'R']",1,"Whenever another outlaw you control enters, Vial Smasher deals 1 damage to target opponent. (Assassins, Mercenaries, Pirates, Rogues, and Warlocks are outlaws.)",{B}{R}
Eroded Canyon,common,"['R', 'U']",4,"This land enters tapped.
When this land enters, it deals 1 damage to target opponent.
{T}: Add {U} or {R}.",
Jagged Barrens,common,"['B', 'R']",4,"This land enters tapped.
When this land enters, it deals 1 damage to target opponent.
{T}: Add {B} or {R}.",
Soured Springs,common,"['B', 'U']",4,"This land enters tapped.
When this land enters, it deals 1 damage to target opponent.
{T}: Add {U} or {B}.",
Spirebluff Canal,rare,"['R', 'U']",1,"This land enters tapped unless you control two or fewer other lands.
{T}: Add {U} or {R}.",
Worldwalker Helm,mythic,['U'],1,"If you would create one or more artifact tokens, instead create those tokens plus an additional Map token. (It's an artifact with ""{1}, {T}, Sacrifice this token: Target creature you control explores. Activate only as a sorcery."")
{1}{U}, {T}: Create a token that's a copy of target artifact token you control.",{2}{U}
Lurking Spinecrawler,uncommon,['B'],1,"When Lurking Spinecrawler enters, you may choose a nonland card in your hand. If you do, that card perpetually incorporates {1}{B} and gains ""When you cast this spell, each opponent sacrifices a creature. Each opponent who can't discards a card.""
Whenever you cast a multicolored spell, for each of that spell's colors, each opponent loses 1 life and you gain 1 life.",{3}{B}
Case of the Market Melee,uncommon,['R'],1,"When this Case enters, it deals 1 damage to any target.
Damage isn't removed from creatures during cleanup steps.
To solve — Three or more creatures are damaged.
Solved — Whenever you attack with one or more creatures, this Case deals that much damage divided as you choose among any number of targets.",{1}{R}
Shove Aside,uncommon,['R'],1,"If you aren't the starting player, you may cast Shove Aside as though it had flash.
Shove Aside deals 3 damage to target creature or planeswalker.",{R}
A-Geological Appraiser,uncommon,['R'],2,"When Geological Appraiser enters, if you cast it, discover 3. (Exile cards from the top of your library until you exile a nonland card with mana value 3 or less. Cast it without paying its mana cost or put it into your hand. Put the rest on the bottom in a random order.)",{3}{R}{R}
Intruder's Inquisition,uncommon,"['B', 'R']",1,"Target creature you control deals damage equal to its power to target creature an opponent controls. If excess damage was dealt to a creature this way, its controller discards a card with the greatest mana value among cards in their hand.",{B}{R}
Cathartic Operation,uncommon,"['B', 'U']",2,"Return up to two target creature cards from your graveyard to your hand, then seek two noncreature, nonland cards.",{3}{U}{B}
"Rankle, Pitiless Trickster",mythic,['B'],1,"Flying
Rankle has lifelink and haste as long as an opponent controls no creatures.
When Rankle enters, you may pay 1 life. When you do, each player discards a card and sacrifices a creature.
Whenever a player discards a card, Rankle perpetually gets +1/+0.",{1}{B}{B}
Switchgrass Grazer,uncommon,['R'],1,"Haste
Whenever Switchgrass Grazer attacks, it deals 1 damage to any target. If Switchgrass Grazer is saddled and a creature was dealt damage this way, that creature perpetually gains ""This creature can't block"" and ""Damage isn't removed from this creature during cleanup steps.""
Saddle 1",{2}{R}{R}
Thieving Aven,uncommon,['U'],2,"Flying
Whenever Thieving Aven deals combat damage to a player, heist target opponent's library.
Whenever you cast a spell you don't own, put a +1/+1 counter on Thieving Aven.",{2}{U}
Impetuous Lootmonger,uncommon,['R'],1,"First strike
When Impetuous Lootmonger enters, discard a card, then heist target opponent's library.
Whenever you cast a spell you don't own, create a tapped Treasure token.",{1}{R}
Triumphant Getaway,rare,"['B', 'R', 'U']",1,"Flash
When Triumphant Getaway enters, heist target opponent's library twice.
Whenever you cast a spell you don't own, each opponent loses 2 life and you gain 2 life.",{1}{U}{B}{R}
Bellowing Crier,common,['U'],3,"When this creature enters, draw a card, then discard a card.",{1}{U}
Calamitous Tide,uncommon,['U'],1,"Return up to two target creatures to their owners' hands. Draw two cards, then discard a card.",{4}{U}{U}
Daring Waverider,uncommon,['U'],1,"When this creature enters, you may cast target instant or sorcery card with mana value 4 or less from your graveyard without paying its mana cost. If that spell would be put into your graveyard, exile it instead.",{4}{U}{U}
Dazzling Denial,common,['U'],2,"Counter target spell unless its controller pays {2}. If you control a Bird, counter that spell unless its controller pays {4} instead.",{1}{U}
Eddymurk Crab,uncommon,['U'],1,"Flash
This spell costs {1} less to cast for each instant and sorcery card in your graveyard.
This creature enters tapped if it's not your turn.
When this creature enters, tap up to two target creatures.",{5}{U}{U}
"Eluge, the Shoreless Sea",mythic,['U'],1,"Eluge's power and toughness are each equal to the number of Islands you control.
Whenever Eluge enters or attacks, put a flood counter on target land. It's an Island in addition to its other types for as long as it has a flood counter on it.
The first instant or sorcery spell you cast each turn costs {U} (or {1}) less to cast for each land you control with a flood counter on it.",{1}{U}{U}{U}
Finch Formation,common,['U'],2,"Offspring {3} (You may pay an additional {3} as you cast this spell. If you do, when this creature enters, create a 1/1 token copy of it.)
Flying
When this creature enters, target creature you control gains flying until end of turn.",{2}{U}
Gossip's Talent,uncommon,['U'],1,"(Gain the next level as a sorcery to add its ability.)
Whenever a creature you control enters, surveil 1.
{1}{U}: Level 2
Whenever you attack, target attacking creature with power 3 or less can't be blocked this turn.
{3}{U}: Level 3
Whenever a creature you control deals combat damage to a player, you may exile it, then return it to the battlefield under its owner's control.",{1}{U}
Lightshell Duo,common,['U'],2,"Prowess (Whenever you cast a noncreature spell, this creature gets +1/+1 until end of turn.)
When this creature enters, surveil 2. (Look at the top two cards of your library, then put any number of them into your graveyard and the rest on top of your library in any order.)",{3}{U}
Mind Spiral,common,['U'],2,"Gift a tapped Fish (You may promise an opponent a gift as you cast this spell. If you do, they create a tapped 1/1 blue Fish creature token before its other effects.)
Target player draws three cards. If the gift was promised, tap target creature an opponent controls and put a stun counter on it. (If a permanent with a stun counter would become untapped, remove one from it instead.)",{4}{U}
Mockingbird,rare,['U'],1,"Flying
You may have this creature enter as a copy of any creature on the battlefield with mana value less than or equal to the amount of mana spent to cast this creature, except it's a Bird in addition to its other types and it has flying.",{X}{U}
Nightwhorl Hermit,common,['U'],1,"Vigilance
Threshold — As long as seven or more cards are in your graveyard, this creature gets +1/+0 and can't be blocked.",{2}{U}
Otterball Antics,uncommon,['U'],2,"Create a 1/1 blue and red Otter creature token with prowess. If this spell was cast from anywhere other than your hand, put a +1/+1 counter on that creature. (Whenever you cast a noncreature spell, a creature with prowess gets +1/+1 until end of turn.)
Flashback {3}{U} (You may cast this card from your graveyard for its flashback cost. Then exile it.)",{1}{U}
Pearl of Wisdom,common,['U'],4,"This spell costs {1} less to cast if you control an Otter.
Draw two cards.",{2}{U}
Portent of Calamity,rare,['U'],1,"Reveal the top X cards of your library. For each card type, you may exile a card of that type from among them. Put the rest into your graveyard. You may cast a spell from among the exiled cards without paying its mana cost if you exiled four or more cards this way. Then put the rest of the exiled cards into your hand.",{X}{U}
Run Away Together,common,['U'],4,Choose two target creatures controlled by different players. Return those creatures to their owners' hands.,{1}{U}
Shoreline Looter,uncommon,['U'],4,"This creature can't be blocked.
Threshold — Whenever this creature deals combat damage to a player, draw a card. Then discard a card unless seven or more cards are in your graveyard.",{1}{U}
Skyskipper Duo,common,['U'],1,"Flying
When this creature enters, exile up to one other target creature you control. Return it to the battlefield under its owner's control at the beginning of the next end step.",{4}{U}
Stormchaser's Talent,rare,['U'],1,"(Gain the next level as a sorcery to add its ability.)
When this Class enters, create a 1/1 blue and red Otter creature token with prowess.
{3}{U}: Level 2
When this Class becomes level 2, return target instant or sorcery card from your graveyard to your hand.
{5}{U}: Level 3
Whenever you cast an instant or sorcery spell, create a 1/1 blue and red Otter creature token with prowess.",{U}
Thought Shucker,common,['U'],1,Threshold — {1}{U}: Put a +1/+1 counter on this creature and draw a card. Activate only if seven or more cards are in your graveyard and only once.,{1}{U}
Waterspout Warden,common,['U'],3,"Whenever this creature attacks, if another creature entered the battlefield under your control this turn, this creature gains flying until end of turn.",{2}{U}
Agate-Blade Assassin,common,['B'],3,"Whenever this creature attacks, defending player loses 1 life and you gain 1 life.",{1}{B}
Bandit's Talent,uncommon,['B'],1,"(Gain the next level as a sorcery to add its ability.)
When this Class enters, each opponent discards two cards unless they discard a nonland card.
{B}: Level 2
At the beginning of each opponent's upkeep, if that player has one or fewer cards in hand, they lose 2 life.
{3}{B}: Level 3
At the beginning of your draw step, draw an additional card for each opponent who has one or fewer cards in hand.",{1}{B}
Bonebind Orator,common,['B'],1,"{3}{B}, Exile this card from your graveyard: Return another target creature card from your graveyard to your hand.",{1}{B}
Daggerfang Duo,common,['B'],3,"Deathtouch
When this creature enters, you may mill two cards. (You may put the top two cards of your library into your graveyard.)",{2}{B}
Early Winter,common,['B'],2,"Choose one —
• Exile target creature.
• Target opponent exiles an enchantment they control.",{4}{B}
Feed the Cycle,uncommon,['B'],1,"As an additional cost to cast this spell, forage or pay {B}. (To forage, exile three cards from your graveyard or sacrifice a Food.)
Destroy target creature or planeswalker.",{1}{B}
Glidedive Duo,common,['B'],1,"Flying
When this creature enters, each opponent loses 2 life and you gain 2 life.",{4}{B}
Hazel's Nocturne,uncommon,['B'],1,Return up to two target creature cards from your graveyard to your hand. Each opponent loses 2 life and you gain 2 life.,{3}{B}
Iridescent Vinelasher,rare,['B'],1,"Offspring {2} (You may pay an additional {2} as you cast this spell. If you do, when this creature enters, create a 1/1 token copy of it.)
Landfall — Whenever a land you control enters, this creature deals 1 damage to target opponent.",{B}
Nocturnal Hunger,common,['B'],4,"Gift a Food (You may promise an opponent a gift as you cast this spell. If you do, they create a Food token before its other effects. It's an artifact with ""{2}, {T}, Sacrifice this token: You gain 3 life."")
Destroy target creature. If the gift wasn't promised, you lose 2 life.",{2}{B}
Persistent Marshstalker,uncommon,['B'],1,"This creature gets +1/+0 for each other Rat you control.
Threshold — Whenever you attack with one or more Rats, if seven or more cards are in your graveyard, you may pay {2}{B}. If you do, return this card from your graveyard to the battlefield tapped and attacking.",{1}{B}
Psychic Whorl,common,['B'],3,"Target opponent discards two cards. Then if you control a Rat, surveil 2. (Look at the top two cards of your library, then put any number of them into your graveyard and the rest on top of your library in any order.)",{2}{B}
Ruthless Negotiation,uncommon,['B'],1,"Target opponent exiles a card from their hand. If this spell was cast from a graveyard, draw a card.
Flashback {4}{B} (You may cast this card from your graveyard for its flashback cost. Then exile it.)",{B}
Savor,common,['B'],3,"Target creature gets -2/-2 until end of turn. Create a Food token. (It's an artifact with ""{2}, {T}, Sacrifice this token: You gain 3 life."")",{1}{B}
Scavenger's Talent,rare,['B'],2,"(Gain the next level as a sorcery to add its ability.)
Whenever one or more creatures you control die, create a Food token. This ability triggers only once each turn.
{1}{B}: Level 2
Whenever you sacrifice a permanent, target player mills two cards.
{2}{B}: Level 3
At the beginning of your end step, you may sacrifice three other nonland permanents. If you do, return a creature card from your graveyard to the battlefield with a finality counter on it.",{B}
Starlit Soothsayer,common,['B'],1,"Flying
At the beginning of your end step, if you gained or lost life this turn, surveil 1. (Look at the top card of your library. You may put it into your graveyard.)",{2}{B}
Starscape Cleric,uncommon,['B'],2,"Offspring {2}{B} (You may pay an additional {2}{B} as you cast this spell. If you do, when this creature enters, create a 1/1 token copy of it.)
Flying
This creature can't block.
Whenever you gain life, each opponent loses 1 life.",{1}{B}
Thornplate Intimidator,common,['B'],2,"Offspring {3} (You may pay an additional {3} as you cast this spell. If you do, when this creature enters, create a 1/1 token copy of it.)
When this creature enters, target opponent loses 3 life unless they sacrifice a nonland permanent of their choice or discard a card.",{3}{B}
Thought-Stalker Warlock,uncommon,['B'],1,"Menace (This creature can't be blocked except by two or more creatures.)
When this creature enters, choose target opponent. If they lost life this turn, they reveal their hand, you choose a nonland card from it, and they discard that card. Otherwise, they discard a card.",{2}{B}
Valley Rotcaller,rare,['B'],1,"Menace
Whenever this creature attacks, each opponent loses X life and you gain X life, where X is the number of other Squirrels, Bats, Lizards, and Rats you control.",{1}{B}
Alania's Pathmaker,common,['R'],4,"When this creature enters, exile the top card of your library. Until the end of your next turn, you may play that card.",{3}{R}
Blooming Blast,uncommon,['R'],1,"Gift a Treasure (You may promise an opponent a gift as you cast this spell. If you do, they create a Treasure token before its other effects. It's an artifact with ""{T}, Sacrifice this token: Add one mana of any color."")
Blooming Blast deals 2 damage to target creature. If the gift was promised, Blooming Blast also deals 3 damage to that creature's controller.",{1}{R}
Brambleguard Captain,uncommon,['R'],2,"At the beginning of combat on your turn, target creature you control gets +X/+0 until end of turn, where X is this creature's power.",{3}{R}
Coruscation Mage,uncommon,['R'],2,"Offspring {2} (You may pay an additional {2} as you cast this spell. If you do, when this creature enters, create a 1/1 token copy of it.)
Whenever you cast a noncreature spell, this creature deals 1 damage to each opponent.",{1}{R}
Conduct Electricity,common,['R'],2,Conduct Electricity deals 6 damage to target creature and 2 damage to up to one target creature token.,{4}{R}
Flamecache Gecko,uncommon,"['B', 'R']",1,"When this creature enters, if an opponent lost life this turn, add {B}{R}.
{1}{R}, Discard a card: Draw a card.",{1}{R}
Frilled Sparkshooter,common,['R'],3,"Menace, reach
This creature enters with a +1/+1 counter on it if an opponent lost life this turn.",{3}{R}
Harnesser of Storms,uncommon,['R'],1,"Whenever you cast a noncreature or Otter spell, you may exile the top card of your library. Until end of turn, you may play that card. This ability triggers only once each turn.",{2}{R}
Hearthborn Battler,rare,['R'],1,"Haste
Whenever a player casts their second spell each turn, this creature deals 2 damage to target opponent.",{2}{R}
Hoarder's Overflow,uncommon,['R'],1,"When this enchantment enters and whenever you expend 4, put a stash counter on it. (You expend 4 as you spend your fourth total mana to cast spells during a turn.)
{1}{R}, Sacrifice this enchantment: Discard your hand, then draw cards equal to the number of stash counters on this enchantment.",{1}{R}
Kindlespark Duo,common,['R'],2,"{T}: This creature deals 1 damage to target opponent.
Whenever you cast a noncreature spell, untap this creature.",{2}{R}
Might of the Meek,common,['R'],3,"Target creature gains trample until end of turn. It also gets +1/+0 until end of turn if you control a Mouse.
Draw a card.",{R}
Playful Shove,uncommon,['R'],2,"Playful Shove deals 1 damage to any target.
Draw a card.",{1}{R}
Quaketusk Boar,uncommon,['R'],3,"Reach, trample, haste",{3}{R}{R}
Rabid Gnaw,uncommon,['R'],3,Target creature you control gets +1/+0 until end of turn. Then it deals damage equal to its power to target creature you don't control.,{1}{R}
Raccoon Rallier,common,['R'],1,{T}: Target creature you control gains haste until end of turn. Activate only as a sorcery.,{1}{R}
Reptilian Recruiter,uncommon,['R'],2,"Trample
When this creature enters, choose target creature. If that creature's power is 2 or less or if you control another Lizard, gain control of that creature until end of turn, untap it, and it gains haste until end of turn.",{3}{R}{R}
Roughshod Duo,common,['R'],1,"Trample
Whenever you expend 4, target creature you control gets +1/+1 and gains trample until end of turn. (You expend 4 as you spend your fourth total mana to cast spells during a turn.)",{2}{R}
Sazacap's Brew,common,['R'],2,"Gift a tapped Fish (You may promise an opponent a gift as you cast this spell. If you do, they create a tapped 1/1 blue Fish creature token before its other effects.)
As an additional cost to cast this spell, discard a card.
Target player draws two cards. If the gift was promised, target creature you control gets +2/+0 until end of turn.",{1}{R}
Steampath Charger,common,['R'],2,"Offspring {2} (You may pay an additional {2} as you cast this spell. If you do, when this creature enters, create a 1/1 token copy of it.)
When this creature dies, it deals 1 damage to target player.",{1}{R}
War Squeak,common,['R'],3,"Enchant creature
When this Aura enters, target creature an opponent controls can't block this turn.
Enchanted creature gets +1/+1 and has haste.",{R}
Whiskerquill Scribe,common,['R'],2,"Valiant — Whenever this creature becomes the target of a spell or ability you control for the first time each turn, you may discard a card. If you do, draw a card.",{1}{R}
Wildfire Howl,uncommon,['R'],1,"Gift a card (You may promise an opponent a gift as you cast this spell. If you do, they draw a card before its other effects.)
Wildfire Howl deals 2 damage to each creature. If the gift was promised, instead Wildfire Howl deals 1 damage to any target and 2 damage to each creature.",{1}{R}{R}
Valley Rally,uncommon,['R'],1,"Gift a Food (You may promise an opponent a gift as you cast this spell. If you do, they create a Food token before its other effects. It's an artifact with ""{2}, {T}, Sacrifice this token: You gain 3 life."")
Creatures you control get +2/+0 until end of turn. If the gift was promised, target creature you control gains first strike until end of turn.",{2}{R}
"Alania, Divergent Storm",rare,"['R', 'U']",2,"Whenever you cast a spell, if it's the first instant spell, the first sorcery spell, or the first Otter spell other than Alania you've cast this turn, you may have target opponent draw a card. If you do, copy that spell. You may choose new targets for the copy.",{3}{U}{R}
Mind Drill Assailant,common,"['B', 'U']",1,"Threshold — As long as seven or more cards are in your graveyard, this creature gets +3/+0.
{2}{U/B}: Surveil 1. (Look at the top card of your library. You may put it into your graveyard.)",{2}{U/B}{U/B}
"Ral, Crackling Wit",mythic,"['R', 'U']",1,"Whenever you cast a noncreature spell, put a loyalty counter on Ral.
[+1]: Create a 1/1 blue and red Otter creature token with prowess.
[−3]: Draw three cards, then discard two cards.
[−10]: Draw three cards. You get an emblem with ""Instant and sorcery spells you cast have storm."" (Whenever you cast an instant or sorcery spell, copy it for each spell cast before it this turn.)",{2}{U}{R}
Stormcatch Mentor,uncommon,"['R', 'U']",3,"Haste
Prowess (Whenever you cast a noncreature spell, this creature gets +1/+1 until end of turn.)
Instant and sorcery spells you cast cost {1} less to cast.",{U}{R}
